title,original_title,score,genre,year,duration,description,actors,public,country,language
Princess Mononoke,Original title: Mononoke-hime,8.3,Animation,1997,,"<p data-testid=""plot"" class=""sc-5f699a2-3 lopbTB""><span role=""presentation"" data-testid=""plot-xs_to_m"" class=""sc-5f699a2-0 kcphyk"">On a journey to find the cure for a Tatarigami's curse, Ashitaka finds himself in the middle of a war between the forest gods and Tatara, a mining colony. In this quest he also meets San, th...<!-- --> <a class=""ipc-link ipc-link--baseAlt"" role=""button"" tabindex=""0"" aria-disabled=""false"" data-testid=""plot-read-all-link"" href=""plotsummary?ref_=tt_ov_pl"">Read all</a></span><span role=""presentation"" data-testid=""plot-l"" class=""sc-5f699a2-1 cfkOAP"">On a journey to find the cure for a Tatarigami's curse, Ashitaka finds himself in the middle of a war between the forest gods and Tatara, a mining colony. In this quest he also meets San, the Mononoke Hime.</span><span role=""presentation"" data-testid=""plot-xl"" class=""sc-5f699a2-2 cxqNYC"">On a journey to find the cure for a Tatarigami's curse, Ashitaka finds himself in the middle of a war between the forest gods and Tatara, a mining colony. In this quest he also meets San, the Mononoke Hime.</span></p>","Yôji Matsuda,Yuriko Ishida,Yûko Tanaka,Billy Crudup,Billy Bob Thornton,Minnie Driver,John DiMaggio,Claire Danes,John DeMita,Jada Pinkett Smith,Gillian Anderson,Keith David,Corey Burton,Tara Strong,Julia Fletcher,Debi Derryberry,Alex Fernandez,Jack Fletcher",PG-13,"<a class=""ipc-metadata-list-item__list-content-item ipc-metadata-list-item__list-content-item--link"" role=""button"" tabindex=""0"" aria-disabled=""false"" href=""/search/title/?colors=color&amp;ref_=tt_spec_att"">Color</a>",
Avengers: Endgame,,8.4,Action,2019,,"<p data-testid=""plot"" class=""sc-5f699a2-3 lopbTB""><span role=""presentation"" data-testid=""plot-xs_to_m"" class=""sc-5f699a2-0 kcphyk"">After the devastating events of Avengers: Infinity War (2018), the universe is in ruins. With the help of remaining allies, the Avengers assemble once more in order to reverse Thanos' action...<!-- --> <a class=""ipc-link ipc-link--baseAlt"" role=""button"" tabindex=""0"" aria-disabled=""false"" data-testid=""plot-read-all-link"" href=""plotsummary?ref_=tt_ov_pl"">Read all</a></span><span role=""presentation"" data-testid=""plot-l"" class=""sc-5f699a2-1 cfkOAP"">After the devastating events of Avengers: Infinity War (2018), the universe is in ruins. With the help of remaining allies, the Avengers assemble once more in order to reverse Thanos' actions and restore balance to the universe.</span><span role=""presentation"" data-testid=""plot-xl"" class=""sc-5f699a2-2 cxqNYC"">After the devastating events of Avengers: Infinity War (2018), the universe is in ruins. With the help of remaining allies, the Avengers assemble once more in order to reverse Thanos' actions and restore balance to the universe.</span></p>","Robert Downey Jr.,Chris Evans,Mark Ruffalo,Chris Hemsworth,Scarlett Johansson,Jeremy Renner,Don Cheadle,Paul Rudd,Benedict Cumberbatch,Chadwick Boseman,Brie Larson,Tom Holland,Karen Gillan,Zoe Saldana,Evangeline Lilly,Tessa Thompson,Rene Russo,Elizabeth Olsen",PG-13,,
Das Boot,,8.4,Drama,1981,,"<p data-testid=""plot"" class=""sc-5f699a2-3 lopbTB""><span role=""presentation"" data-testid=""plot-xs_to_m"" class=""sc-5f699a2-0 kcphyk"">A German U-boat stalks the frigid waters of the North Atlantic as its young crew experience the sheer terror and claustrophobic life of a submariner in World War II.</span><span role=""presentation"" data-testid=""plot-l"" class=""sc-5f699a2-1 cfkOAP"">A German U-boat stalks the frigid waters of the North Atlantic as its young crew experience the sheer terror and claustrophobic life of a submariner in World War II.</span><span role=""presentation"" data-testid=""plot-xl"" class=""sc-5f699a2-2 cxqNYC"">A German U-boat stalks the frigid waters of the North Atlantic as its young crew experience the sheer terror and claustrophobic life of a submariner in World War II.</span></p>","Jürgen Prochnow,Herbert Grönemeyer,Klaus Wennemann,Hubertus Bengsch,Martin Semmelrogge,Bernd Tauber,Erwin Leder,Martin May,Heinz Hoenig,Uwe Ochsenknecht,Claude-Oliver Rudolph,Jan Fedder,Ralf Richter,Joachim Bernhard,Oliver Stritzel,Konrad Becker,Lutz Schnell,Martin Hemme",,"<a class=""ipc-metadata-list-item__list-content-item ipc-metadata-list-item__list-content-item--link"" role=""button"" tabindex=""0"" aria-disabled=""false"" href=""/search/title/?colors=color&amp;ref_=tt_spec_att"">Color</a>",
Joker,,8.4,Crime,2019,,"<p data-testid=""plot"" class=""sc-5f699a2-3 lopbTB""><span role=""presentation"" data-testid=""plot-xs_to_m"" class=""sc-5f699a2-0 kcphyk"">The rise of Arthur Fleck, from aspiring stand-up comedian and pariah to Gotham's clown prince and leader of the revolution.</span><span role=""presentation"" data-testid=""plot-l"" class=""sc-5f699a2-1 cfkOAP"">The rise of Arthur Fleck, from aspiring stand-up comedian and pariah to Gotham's clown prince and leader of the revolution.</span><span role=""presentation"" data-testid=""plot-xl"" class=""sc-5f699a2-2 cxqNYC"">The rise of Arthur Fleck, from aspiring stand-up comedian and pariah to Gotham's clown prince and leader of the revolution.</span></p>","Joaquin Phoenix,Robert De Niro,Zazie Beetz,Frances Conroy,Brett Cullen,Shea Whigham,Bill Camp,Glenn Fleshler,Leigh Gill,Josh Pais,Rocco Luna,Marc Maron,Sondra James,Murphy Guyer,Douglas Hodge,Dante Pereira-Olson,Carrie Louise Putrello,Sharon Washington",R,"<a class=""ipc-metadata-list-item__list-content-item ipc-metadata-list-item__list-content-item--link"" role=""button"" tabindex=""0"" aria-disabled=""false"" href=""/search/title/?country_of_origin=US&amp;ref_=tt_dt_cn"">United States</a>","<a class=""ipc-metadata-list-item__list-content-item ipc-metadata-list-item__list-content-item--link"" role=""button"" tabindex=""0"" aria-disabled=""false"" href=""/search/title?title_type=feature&amp;primary_language=en&amp;sort=moviemeter,asc&amp;ref_=tt_dt_ln"">English</a>"
Braveheart,,8.4,Biography,1995,,"<p data-testid=""plot"" class=""sc-5f699a2-3 lopbTB""><span role=""presentation"" data-testid=""plot-xs_to_m"" class=""sc-5f699a2-0 kcphyk"">Scottish warrior William Wallace leads his countrymen in a rebellion to free his homeland from the tyranny of King Edward I of England.</span><span role=""presentation"" data-testid=""plot-l"" class=""sc-5f699a2-1 cfkOAP"">Scottish warrior William Wallace leads his countrymen in a rebellion to free his homeland from the tyranny of King Edward I of England.</span><span role=""presentation"" data-testid=""plot-xl"" class=""sc-5f699a2-2 cxqNYC"">Scottish warrior William Wallace leads his countrymen in a rebellion to free his homeland from the tyranny of King Edward I of England.</span></p>","Mel Gibson,Sophie Marceau,Patrick McGoohan,Angus Macfadyen,James Robinson,Sean Lawlor,Sandy Nelson,James Cosmo,Sean McGinley,Alan Tall,Andrew Weir,Gerda Stevenson,Ralph Riach,Mhairi Calvey,Brian Cox,Peter Hanly,Stephen Billington,Barry McGovern",R,"<a class=""ipc-metadata-list-item__list-content-item ipc-metadata-list-item__list-content-item--link"" role=""button"" tabindex=""0"" aria-disabled=""false"" href=""/search/title/?colors=color&amp;ref_=tt_spec_att"">Color</a>",
Toy Story,,8.3,Animation,1995,,"<p data-testid=""plot"" class=""sc-5f699a2-3 lopbTB""><span role=""presentation"" data-testid=""plot-xs_to_m"" class=""sc-5f699a2-0 kcphyk"">A cowboy doll is profoundly threatened and jealous when a new spaceman action figure supplants him as top toy in a boy's bedroom.</span><span role=""presentation"" data-testid=""plot-l"" class=""sc-5f699a2-1 cfkOAP"">A cowboy doll is profoundly threatened and jealous when a new spaceman action figure supplants him as top toy in a boy's bedroom.</span><span role=""presentation"" data-testid=""plot-xl"" class=""sc-5f699a2-2 cxqNYC"">A cowboy doll is profoundly threatened and jealous when a new spaceman action figure supplants him as top toy in a boy's bedroom.</span></p>","Tom Hanks,Tim Allen,Don Rickles,Jim Varney,Wallace Shawn,John Ratzenberger,Annie Potts,John Morris,Erik von Detten,Laurie Metcalf,R. Lee Ermey,Sarah Rayne,Penn Jillette,Jack Angel,Spencer Aste,Greg Berg,Lisa Bradley,Kendall Cunningham",G,,
Coco,,8.4,Animation,2017,,"<p data-testid=""plot"" class=""sc-5f699a2-3 lopbTB""><span role=""presentation"" data-testid=""plot-xs_to_m"" class=""sc-5f699a2-0 kcphyk"">Aspiring musician Miguel, confronted with his family's ancestral ban on music, enters the Land of the Dead to find his great-great-grandfather, a legendary singer.</span><span role=""presentation"" data-testid=""plot-l"" class=""sc-5f699a2-1 cfkOAP"">Aspiring musician Miguel, confronted with his family's ancestral ban on music, enters the Land of the Dead to find his great-great-grandfather, a legendary singer.</span><span role=""presentation"" data-testid=""plot-xl"" class=""sc-5f699a2-2 cxqNYC"">Aspiring musician Miguel, confronted with his family's ancestral ban on music, enters the Land of the Dead to find his great-great-grandfather, a legendary singer.</span></p>","Anthony Gonzalez,Gael García Bernal,Benjamin Bratt,Alanna Ubach,Renee Victor,Jaime Camil,Alfonso Arau,Herbert Siguenza,Gabriel Iglesias,Lombardo Boyar,Ana Ofelia Murguía,Natalia Cordova-Buckley,Selene Luna,Edward James Olmos,Sofía Espinosa,Carla Medina,Dyana Ortelli,Luis Valdez",PG,"<a class=""ipc-metadata-list-item__list-content-item ipc-metadata-list-item__list-content-item--link"" role=""button"" tabindex=""0"" aria-disabled=""false"" href=""/search/title/?colors=color&amp;ref_=tt_spec_att"">Color</a>",
Amadeus,,8.4,Biography,1984,,"<p data-testid=""plot"" class=""sc-5f699a2-3 lopbTB""><span role=""presentation"" data-testid=""plot-xs_to_m"" class=""sc-5f699a2-0 kcphyk"">The life, success and troubles of Wolfgang Amadeus Mozart, as told by Antonio Salieri, the contemporaneous composer who was deeply jealous of Mozart's talent and claimed to have murdered him...<!-- --> <a class=""ipc-link ipc-link--baseAlt"" role=""button"" tabindex=""0"" aria-disabled=""false"" data-testid=""plot-read-all-link"" href=""plotsummary?ref_=tt_ov_pl"">Read all</a></span><span role=""presentation"" data-testid=""plot-l"" class=""sc-5f699a2-1 cfkOAP"">The life, success and troubles of Wolfgang Amadeus Mozart, as told by Antonio Salieri, the contemporaneous composer who was deeply jealous of Mozart's talent and claimed to have murdered him.</span><span role=""presentation"" data-testid=""plot-xl"" class=""sc-5f699a2-2 cxqNYC"">The life, success and troubles of Wolfgang Amadeus Mozart, as told by Antonio Salieri, the contemporaneous composer who was deeply jealous of Mozart's talent and claimed to have murdered him.</span></p>","F. Murray Abraham,Tom Hulce,Elizabeth Berridge,Roy Dotrice,Simon Callow,Christine Ebersole,Jeffrey Jones,Charles Kay,Kenneth McMillan,Kenny Baker,Lisbeth Bartlett,Barbara Bryne,Martin Cavina,Roderick Cook,Milan Demjanenko,Peter DiGesu,Richard Frank,Patrick Hines",PG,,
Inglourious Basterds,,8.3,Adventure,2009,,"<p data-testid=""plot"" class=""sc-5f699a2-3 lopbTB""><span role=""presentation"" data-testid=""plot-xs_to_m"" class=""sc-5f699a2-0 kcphyk"">In Nazi-occupied France during World War II, a plan to assassinate Nazi leaders by a group of Jewish U.S. soldiers coincides with a theatre owner's vengeful plans for the same.</span><span role=""presentation"" data-testid=""plot-l"" class=""sc-5f699a2-1 cfkOAP"">In Nazi-occupied France during World War II, a plan to assassinate Nazi leaders by a group of Jewish U.S. soldiers coincides with a theatre owner's vengeful plans for the same.</span><span role=""presentation"" data-testid=""plot-xl"" class=""sc-5f699a2-2 cxqNYC"">In Nazi-occupied France during World War II, a plan to assassinate Nazi leaders by a group of Jewish U.S. soldiers coincides with a theatre owner's vengeful plans for the same.</span></p>","Brad Pitt,Diane Kruger,Eli Roth,Mélanie Laurent,Christoph Waltz,Michael Fassbender,Daniel Brühl,Til Schweiger,Gedeon Burkhard,Jacky Ido,B.J. Novak,Omar Doom,August Diehl,Denis Ménochet,Sylvester Groth,Martin Wuttke,Mike Myers,Julie Dreyfus",R,"<a class=""ipc-metadata-list-item__list-content-item ipc-metadata-list-item__list-content-item--link"" role=""button"" tabindex=""0"" aria-disabled=""false"" href=""/search/title/?colors=color&amp;ref_=tt_spec_att"">Color</a>",
Oldboy,Original title: Oldeuboi,8.4,Action,2003,,"<p data-testid=""plot"" class=""sc-5f699a2-3 lopbTB""><span role=""presentation"" data-testid=""plot-xs_to_m"" class=""sc-5f699a2-0 kcphyk"">After being kidnapped and imprisoned for fifteen years, Oh Dae-Su is released, only to find that he must find his captor in five days.</span><span role=""presentation"" data-testid=""plot-l"" class=""sc-5f699a2-1 cfkOAP"">After being kidnapped and imprisoned for fifteen years, Oh Dae-Su is released, only to find that he must find his captor in five days.</span><span role=""presentation"" data-testid=""plot-xl"" class=""sc-5f699a2-2 cxqNYC"">After being kidnapped and imprisoned for fifteen years, Oh Dae-Su is released, only to find that he must find his captor in five days.</span></p>","Choi Min-sik,Yoo Ji-tae,Kang Hye-jeong,Kim Byeong-Ok,Dae-han Ji,Dal-su Oh,Seung-shin Lee,Jin-Seo Yoon,Tae-kyung Oh,Yoo Yeon-Seok,Il-han Oo,Young-hee Lee,Young-ae Kim,Mi Mi Lee,Jae-Duk Han,Jung Ae Kwak,San Kim,Chae-soo Jang",R,"<a class=""ipc-metadata-list-item__list-content-item ipc-metadata-list-item__list-content-item--link"" role=""button"" tabindex=""0"" aria-disabled=""false"" href=""/search/title/?colors=color&amp;ref_=tt_spec_att"">Color</a>",
The Dark Knight Rises,,8.4,Action,2012,,"<p data-testid=""plot"" class=""sc-5f699a2-3 lopbTB""><span role=""presentation"" data-testid=""plot-xs_to_m"" class=""sc-5f699a2-0 kcphyk"">Eight years after the Joker's reign of chaos, Batman is coerced out of exile with the assistance of the mysterious Selina Kyle in order to defend Gotham City from the vicious guerrilla terro...<!-- --> <a class=""ipc-link ipc-link--baseAlt"" role=""button"" tabindex=""0"" aria-disabled=""false"" data-testid=""plot-read-all-link"" href=""plotsummary?ref_=tt_ov_pl"">Read all</a></span><span role=""presentation"" data-testid=""plot-l"" class=""sc-5f699a2-1 cfkOAP"">Eight years after the Joker's reign of chaos, Batman is coerced out of exile with the assistance of the mysterious Selina Kyle in order to defend Gotham City from the vicious guerrilla terrorist Bane.</span><span role=""presentation"" data-testid=""plot-xl"" class=""sc-5f699a2-2 cxqNYC"">Eight years after the Joker's reign of chaos, Batman is coerced out of exile with the assistance of the mysterious Selina Kyle in order to defend Gotham City from the vicious guerrilla terrorist Bane.</span></p>","Christian Bale,Tom Hardy,Anne Hathaway,Gary Oldman,Joseph Gordon-Levitt,Marion Cotillard,Morgan Freeman,Michael Caine,Matthew Modine,Alon Aboutboul,Ben Mendelsohn,Burn Gorman,Daniel Sunjata,Aidan Gillen,Sam Kennard,Aliash Tepina,Nestor Carbonell,Brett Cullen",PG-13,,
Dr. Strangelove or: How I Learned to Stop Worrying and Love the Bomb,,8.4,Comedy,1964,,"<p data-testid=""plot"" class=""sc-5f699a2-3 lopbTB""><span role=""presentation"" data-testid=""plot-xs_to_m"" class=""sc-5f699a2-0 kcphyk"">An insane American general orders a bombing attack on the Soviet Union, triggering a path to nuclear holocaust that a war room full of politicians and generals frantically tries to stop.</span><span role=""presentation"" data-testid=""plot-l"" class=""sc-5f699a2-1 cfkOAP"">An insane American general orders a bombing attack on the Soviet Union, triggering a path to nuclear holocaust that a war room full of politicians and generals frantically tries to stop.</span><span role=""presentation"" data-testid=""plot-xl"" class=""sc-5f699a2-2 cxqNYC"">An insane American general orders a bombing attack on the Soviet Union, triggering a path to nuclear holocaust that a war room full of politicians and generals frantically tries to stop.</span></p>","Peter Sellers,George C. Scott,Sterling Hayden,Keenan Wynn,Slim Pickens,Peter Bull,James Earl Jones,Tracy Reed,Jack Creley,Frank Berry,Robert O'Neil,Glenn Beck,Roy Stephens,Shane Rimmer,Hal Galili,Paul Tamarin,Laurence Herder,Gordon Tanner",PG,,
American Beauty,,8.4,Drama,1999,,"<p data-testid=""plot"" class=""sc-5f699a2-3 lopbTB""><span role=""presentation"" data-testid=""plot-xs_to_m"" class=""sc-5f699a2-0 kcphyk"">A sexually frustrated suburban father has a mid-life crisis after becoming infatuated with his daughter's best friend.</span><span role=""presentation"" data-testid=""plot-l"" class=""sc-5f699a2-1 cfkOAP"">A sexually frustrated suburban father has a mid-life crisis after becoming infatuated with his daughter's best friend.</span><span role=""presentation"" data-testid=""plot-xl"" class=""sc-5f699a2-2 cxqNYC"">A sexually frustrated suburban father has a mid-life crisis after becoming infatuated with his daughter's best friend.</span></p>","Kevin Spacey,Annette Bening,Thora Birch,Wes Bentley,Mena Suvari,Peter Gallagher,Allison Janney,Chris Cooper,Scott Bakula,Sam Robards,Barry Del Sherman,Ara Celi,John Cho,Fort Atkinson,Sue Casey,Kent Faulcon,Brenda Wehle,Lisa Cloud",R,"<a class=""ipc-metadata-list-item__list-content-item ipc-metadata-list-item__list-content-item--link"" role=""button"" tabindex=""0"" aria-disabled=""false"" href=""/search/title/?colors=color&amp;ref_=tt_spec_att"">Color</a>",
Spider-Man: Into the Spider-Verse,,8.4,Animation,2018,,"<p data-testid=""plot"" class=""sc-5f699a2-3 lopbTB""><span role=""presentation"" data-testid=""plot-xs_to_m"" class=""sc-5f699a2-0 kcphyk"">Teen Miles Morales becomes the Spider-Man of his universe, and must join with five spider-powered individuals from other dimensions to stop a threat for all realities.</span><span role=""presentation"" data-testid=""plot-l"" class=""sc-5f699a2-1 cfkOAP"">Teen Miles Morales becomes the Spider-Man of his universe, and must join with five spider-powered individuals from other dimensions to stop a threat for all realities.</span><span role=""presentation"" data-testid=""plot-xl"" class=""sc-5f699a2-2 cxqNYC"">Teen Miles Morales becomes the Spider-Man of his universe, and must join with five spider-powered individuals from other dimensions to stop a threat for all realities.</span></p>","Shameik Moore,Jake Johnson,Hailee Steinfeld,Mahershala Ali,Brian Tyree Henry,Lily Tomlin,Luna Lauren Velez,Zoë Kravitz,John Mulaney,Kimiko Glenn,Nicolas Cage,Kathryn Hahn,Liev Schreiber,Chris Pine,Natalie Morales,Edwin R. Habacon,Oscar Isaac,Greta Lee",PG,,
Aliens,,8.4,Action,1986,,"<p data-testid=""plot"" class=""sc-5f699a2-3 lopbTB""><span role=""presentation"" data-testid=""plot-xs_to_m"" class=""sc-5f699a2-0 kcphyk"">Decades after surviving the Nostromo incident, Ellen Ripley is sent out to re-establish contact with a terraforming colony but finds herself battling the Alien Queen and her offspring.</span><span role=""presentation"" data-testid=""plot-l"" class=""sc-5f699a2-1 cfkOAP"">Decades after surviving the Nostromo incident, Ellen Ripley is sent out to re-establish contact with a terraforming colony but finds herself battling the Alien Queen and her offspring.</span><span role=""presentation"" data-testid=""plot-xl"" class=""sc-5f699a2-2 cxqNYC"">Decades after surviving the Nostromo incident, Ellen Ripley is sent out to re-establish contact with a terraforming colony but finds herself battling the Alien Queen and her offspring.</span></p>","Sigourney Weaver,Michael Biehn,Carrie Henn,Paul Reiser,Lance Henriksen,Bill Paxton,William Hope,Jenette Goldstein,Al Matthews,Mark Rolston,Ricco Ross,Colette Hiller,Daniel Kash,Cynthia Dale Scott,Tip Tipping,Trevor Steedman,Paul Maxwell,Valerie Colgan",R,"<a class=""ipc-metadata-list-item__list-content-item ipc-metadata-list-item__list-content-item--link"" role=""button"" tabindex=""0"" aria-disabled=""false"" href=""/search/title/?colors=color&amp;ref_=tt_spec_att"">Color</a>",
Witness for the Prosecution,,8.4,Crime,1957,,"<p data-testid=""plot"" class=""sc-5f699a2-3 lopbTB""><span role=""presentation"" data-testid=""plot-xs_to_m"" class=""sc-5f699a2-0 kcphyk"">A veteran British barrister must defend his client in a murder trial that has surprise after surprise.</span><span role=""presentation"" data-testid=""plot-l"" class=""sc-5f699a2-1 cfkOAP"">A veteran British barrister must defend his client in a murder trial that has surprise after surprise.</span><span role=""presentation"" data-testid=""plot-xl"" class=""sc-5f699a2-2 cxqNYC"">A veteran British barrister must defend his client in a murder trial that has surprise after surprise.</span></p>","Tyrone Power,Marlene Dietrich,Charles Laughton,Elsa Lanchester,John Williams,Henry Daniell,Ian Wolfe,Torin Thatcher,Norma Varden,Una O'Connor,Francis Compton,Philip Tonge,Ruta Lee,Patrick Aherne,Don Ames,Walter Bacon,Eddie Baker,Benjie Bancroft",Approved,"<a class=""ipc-metadata-list-item__list-content-item ipc-metadata-list-item__list-content-item--link"" role=""button"" tabindex=""0"" aria-disabled=""false"" href=""/search/title/?colors=black_and_white&amp;ref_=tt_spec_att"">Black and White</a>",
Avengers: Infinity War,,8.4,Action,2018,,"<p data-testid=""plot"" class=""sc-5f699a2-3 lopbTB""><span role=""presentation"" data-testid=""plot-xs_to_m"" class=""sc-5f699a2-0 kcphyk"">The Avengers and their allies must be willing to sacrifice all in an attempt to defeat the powerful Thanos before his blitz of devastation and ruin puts an end to the universe.</span><span role=""presentation"" data-testid=""plot-l"" class=""sc-5f699a2-1 cfkOAP"">The Avengers and their allies must be willing to sacrifice all in an attempt to defeat the powerful Thanos before his blitz of devastation and ruin puts an end to the universe.</span><span role=""presentation"" data-testid=""plot-xl"" class=""sc-5f699a2-2 cxqNYC"">The Avengers and their allies must be willing to sacrifice all in an attempt to defeat the powerful Thanos before his blitz of devastation and ruin puts an end to the universe.</span></p>","Robert Downey Jr.,Chris Hemsworth,Mark Ruffalo,Chris Evans,Scarlett Johansson,Don Cheadle,Benedict Cumberbatch,Tom Holland,Chadwick Boseman,Zoe Saldana,Karen Gillan,Tom Hiddleston,Paul Bettany,Elizabeth Olsen,Anthony Mackie,Sebastian Stan,Idris Elba,Danai Gurira",PG-13,,
The Great Dictator,,8.4,Comedy,1940,,"<p data-testid=""plot"" class=""sc-5f699a2-3 lopbTB""><span role=""presentation"" data-testid=""plot-xs_to_m"" class=""sc-5f699a2-0 kcphyk"">Dictator Adenoid Hynkel tries to expand his empire while a poor Jewish barber tries to avoid persecution from Hynkel's regime.</span><span role=""presentation"" data-testid=""plot-l"" class=""sc-5f699a2-1 cfkOAP"">Dictator Adenoid Hynkel tries to expand his empire while a poor Jewish barber tries to avoid persecution from Hynkel's regime.</span><span role=""presentation"" data-testid=""plot-xl"" class=""sc-5f699a2-2 cxqNYC"">Dictator Adenoid Hynkel tries to expand his empire while a poor Jewish barber tries to avoid persecution from Hynkel's regime.</span></p>","Charles Chaplin,Paulette Goddard,Jack Oakie,Reginald Gardiner,Henry Daniell,Billy Gilbert,Grace Hayle,Carter DeHaven,Maurice Moscovitch,Emma Dunn,Bernard Gorcey,Paul Weigel,Chester Conklin,Esther Michelson,Hank Mann,Florence Wright,Eddie Gribbon,Rudolph Anders",G,"<a class=""ipc-metadata-list-item__list-content-item ipc-metadata-list-item__list-content-item--link"" role=""button"" tabindex=""0"" aria-disabled=""false"" href=""/search/title/?colors=black_and_white&amp;ref_=tt_spec_att"">Black and White</a>",
The Shining,,8.4,Drama,1980,,"<p data-testid=""plot"" class=""sc-5f699a2-3 lopbTB""><span role=""presentation"" data-testid=""plot-xs_to_m"" class=""sc-5f699a2-0 kcphyk"">A family heads to an isolated hotel for the winter where a sinister presence influences the father into violence, while his psychic son sees horrific forebodings from both past and future.</span><span role=""presentation"" data-testid=""plot-l"" class=""sc-5f699a2-1 cfkOAP"">A family heads to an isolated hotel for the winter where a sinister presence influences the father into violence, while his psychic son sees horrific forebodings from both past and future.</span><span role=""presentation"" data-testid=""plot-xl"" class=""sc-5f699a2-2 cxqNYC"">A family heads to an isolated hotel for the winter where a sinister presence influences the father into violence, while his psychic son sees horrific forebodings from both past and future.</span></p>","Jack Nicholson,Shelley Duvall,Danny Lloyd,Scatman Crothers,Barry Nelson,Philip Stone,Joe Turkel,Anne Jackson,Tony Burton,Lia Beldam,Billie Gibson,Barry Dennen,David Baxt,Manning Redwood,Lisa Burns,Louise Burns,Robin Pappas,Alison Coleridge",R,"<a class=""ipc-metadata-list-item__list-content-item ipc-metadata-list-item__list-content-item--link"" role=""button"" tabindex=""0"" aria-disabled=""false"" href=""/search/title/?colors=color&amp;ref_=tt_spec_att"">Color</a>",
