title,original_title,score,genre,year,duration,description,actors,public,country,language
The Shawshank Redemption,,9.3,Drama,1994,,"<p data-testid=""plot"" class=""sc-5f699a2-3 lopbTB""><span role=""presentation"" data-testid=""plot-xs_to_m"" class=""sc-5f699a2-0 kcphyk"">Over the course of several years, two convicts form a friendship, seeking consolation and, eventually, redemption through basic compassion.</span><span role=""presentation"" data-testid=""plot-l"" class=""sc-5f699a2-1 cfkOAP"">Over the course of several years, two convicts form a friendship, seeking consolation and, eventually, redemption through basic compassion.</span><span role=""presentation"" data-testid=""plot-xl"" class=""sc-5f699a2-2 cxqNYC"">Over the course of several years, two convicts form a friendship, seeking consolation and, eventually, redemption through basic compassion.</span></p>","Tim Robbins,Morgan Freeman,Bob Gunton,William Sadler,Clancy Brown,Gil Bellows,Mark Rolston,James Whitmore,Jeffrey DeMunn,Larry Brandenburg,Neil Giuntoli,Brian Libby,David Proval,Joseph Ragno,Jude Ciccolella,Paul McCrane,Renee Blaine,Scott Mann",R,,
The Godfather,,9.2,Crime,1972,,"<p data-testid=""plot"" class=""sc-5f699a2-3 lopbTB""><span role=""presentation"" data-testid=""plot-xs_to_m"" class=""sc-5f699a2-0 kcphyk"">The aging patriarch of an organized crime dynasty in postwar New York City transfers control of his clandestine empire to his reluctant youngest son.</span><span role=""presentation"" data-testid=""plot-l"" class=""sc-5f699a2-1 cfkOAP"">The aging patriarch of an organized crime dynasty in postwar New York City transfers control of his clandestine empire to his reluctant youngest son.</span><span role=""presentation"" data-testid=""plot-xl"" class=""sc-5f699a2-2 cxqNYC"">The aging patriarch of an organized crime dynasty in postwar New York City transfers control of his clandestine empire to his reluctant youngest son.</span></p>","Marlon Brando,Al Pacino,James Caan,Diane Keaton,Richard S. Castellano,Robert Duvall,Sterling Hayden,John Marley,Richard Conte,Al Lettieri,Abe Vigoda,Talia Shire,Gianni Russo,John Cazale,Rudy Bond,Al Martino,Morgana King,Lenny Montana",R,"<a class=""ipc-metadata-list-item__list-content-item ipc-metadata-list-item__list-content-item--link"" role=""button"" tabindex=""0"" aria-disabled=""false"" href=""/search/title/?colors=color&amp;ref_=tt_spec_att"">Color</a>",
The Dark Knight,,9.0,Action,2008,,"<p data-testid=""plot"" class=""sc-5f699a2-3 lopbTB""><span role=""presentation"" data-testid=""plot-xs_to_m"" class=""sc-5f699a2-0 kcphyk"">When the menace known as the Joker wreaks havoc and chaos on the people of Gotham, Batman must accept one of the greatest psychological and physical tests of his ability to fight injustice.</span><span role=""presentation"" data-testid=""plot-l"" class=""sc-5f699a2-1 cfkOAP"">When the menace known as the Joker wreaks havoc and chaos on the people of Gotham, Batman must accept one of the greatest psychological and physical tests of his ability to fight injustice.</span><span role=""presentation"" data-testid=""plot-xl"" class=""sc-5f699a2-2 cxqNYC"">When the menace known as the Joker wreaks havoc and chaos on the people of Gotham, Batman must accept one of the greatest psychological and physical tests of his ability to fight injustice.</span></p>","Christian Bale,Heath Ledger,Aaron Eckhart,Michael Caine,Maggie Gyllenhaal,Gary Oldman,Morgan Freeman,Monique Gabriela Curnen,Ron Dean,Cillian Murphy,Chin Han,Nestor Carbonell,Eric Roberts,Ritchie Coster,Anthony Michael Hall,Keith Szarabajka,Colin McFarlane,Joshua Harto",PG-13,,
The Godfather Part II,,9.0,Crime,1974,,"<p data-testid=""plot"" class=""sc-5f699a2-3 lopbTB""><span role=""presentation"" data-testid=""plot-xs_to_m"" class=""sc-5f699a2-0 kcphyk"">The early life and career of Vito Corleone in 1920s New York City is portrayed, while his son, Michael, expands and tightens his grip on the family crime syndicate.</span><span role=""presentation"" data-testid=""plot-l"" class=""sc-5f699a2-1 cfkOAP"">The early life and career of Vito Corleone in 1920s New York City is portrayed, while his son, Michael, expands and tightens his grip on the family crime syndicate.</span><span role=""presentation"" data-testid=""plot-xl"" class=""sc-5f699a2-2 cxqNYC"">The early life and career of Vito Corleone in 1920s New York City is portrayed, while his son, Michael, expands and tightens his grip on the family crime syndicate.</span></p>","Al Pacino,Robert De Niro,Robert Duvall,Diane Keaton,John Cazale,Talia Shire,Lee Strasberg,Michael V. Gazzo,G.D. Spradlin,Richard Bright,Gastone Moschin,Tom Rosqui,Bruno Kirby,Frank Sivero,Francesca De Sapio,Morgana King,Marianna Hill,Leopoldo Trieste",R,"<a class=""ipc-metadata-list-item__list-content-item ipc-metadata-list-item__list-content-item--link"" role=""button"" tabindex=""0"" aria-disabled=""false"" href=""/search/title/?colors=color&amp;ref_=tt_spec_att"">Color</a>",
Pather Panchali,,8.2,Drama,1955,,"<p data-testid=""plot"" class=""sc-5f699a2-3 lopbTB""><span role=""presentation"" data-testid=""plot-xs_to_m"" class=""sc-5f699a2-0 kcphyk"">Impoverished priest Harihar Ray, dreaming of a better life for himself and his family, leaves his rural Bengal village in search of work.</span><span role=""presentation"" data-testid=""plot-l"" class=""sc-5f699a2-1 cfkOAP"">Impoverished priest Harihar Ray, dreaming of a better life for himself and his family, leaves his rural Bengal village in search of work.</span><span role=""presentation"" data-testid=""plot-xl"" class=""sc-5f699a2-2 cxqNYC"">Impoverished priest Harihar Ray, dreaming of a better life for himself and his family, leaves his rural Bengal village in search of work.</span></p>","Kanu Bannerjee,Karuna Bannerjee,Subir Banerjee,Chunibala Devi,Uma Das Gupta,Runki Banerjee,Reba Devi,Aparna Devi,Tulsi Chakraborty,Haren Banerjee,Rampada Das,Nibhanani Devi,Rama Gangopadhaya,Roma Ganguli,Binoy Mukherjee,Haridhan Nag,Harimohan Nag,Kshirod Roy",Not Rated,"<a class=""ipc-metadata-list-item__list-content-item ipc-metadata-list-item__list-content-item--link"" role=""button"" tabindex=""0"" aria-disabled=""false"" href=""/search/title/?colors=black_and_white&amp;ref_=tt_spec_att"">Black and White</a>",
The Battle of Algiers,Original title: La battaglia di Algeri,8.1,Drama,1966,,"<p data-testid=""plot"" class=""sc-5f699a2-3 lopbTB""><span role=""presentation"" data-testid=""plot-xs_to_m"" class=""sc-5f699a2-0 kcphyk"">In the 1950s, fear and violence escalate as the people of Algiers fight for independence from the French government.</span><span role=""presentation"" data-testid=""plot-l"" class=""sc-5f699a2-1 cfkOAP"">In the 1950s, fear and violence escalate as the people of Algiers fight for independence from the French government.</span><span role=""presentation"" data-testid=""plot-xl"" class=""sc-5f699a2-2 cxqNYC"">In the 1950s, fear and violence escalate as the people of Algiers fight for independence from the French government.</span></p>","Brahim Hadjadj,Jean Martin,Yacef Saadi,Samia Kerbash,Ugo Paletti,Fusia El Kader,Mohamed Ben Kassen,Franco Moruzzi,Tommaso Neri,Rouïched,Gene Wesson",Not Rated,"<a class=""ipc-metadata-list-item__list-content-item ipc-metadata-list-item__list-content-item--link"" role=""button"" tabindex=""0"" aria-disabled=""false"" href=""/search/title/?colors=black_and_white&amp;ref_=tt_spec_att"">Black and White</a>",
Hachi: A Dog's Tale,,8.1,Biography,2009,,"<p data-testid=""plot"" class=""sc-5f699a2-3 lopbTB""><span role=""presentation"" data-testid=""plot-xs_to_m"" class=""sc-5f699a2-0 kcphyk"">A college professor bonds with an abandoned dog he takes into his home.</span><span role=""presentation"" data-testid=""plot-l"" class=""sc-5f699a2-1 cfkOAP"">A college professor bonds with an abandoned dog he takes into his home.</span><span role=""presentation"" data-testid=""plot-xl"" class=""sc-5f699a2-2 cxqNYC"">A college professor bonds with an abandoned dog he takes into his home.</span></p>","Richard Gere,Joan Allen,Cary-Hiroyuki Tagawa,Sarah Roemer,Jason Alexander,Erick Avari,Davenia McFadden,Robbie Sublett,Kevin DeCoste,Rob Degnan,Tora Hallström,Donna Sorbello,Frank S. Aronson,Troy Doherty,Ian Sherman,Timothy Crowe,Denece Ryland,Blake Friedman",G,,
Pirates of the Caribbean: The Curse of the Black Pearl,,8.1,Action,2003,,"<p data-testid=""plot"" class=""sc-5f699a2-3 lopbTB""><span role=""presentation"" data-testid=""plot-xs_to_m"" class=""sc-5f699a2-0 kcphyk"">Blacksmith Will Turner teams up with eccentric pirate ""Captain"" Jack Sparrow to save his love, the governor's daughter, from Jack's former pirate allies, who are now undead.</span><span role=""presentation"" data-testid=""plot-l"" class=""sc-5f699a2-1 cfkOAP"">Blacksmith Will Turner teams up with eccentric pirate ""Captain"" Jack Sparrow to save his love, the governor's daughter, from Jack's former pirate allies, who are now undead.</span><span role=""presentation"" data-testid=""plot-xl"" class=""sc-5f699a2-2 cxqNYC"">Blacksmith Will Turner teams up with eccentric pirate ""Captain"" Jack Sparrow to save his love, the governor's daughter, from Jack's former pirate allies, who are now undead.</span></p>","Johnny Depp,Geoffrey Rush,Orlando Bloom,Keira Knightley,Jack Davenport,Jonathan Pryce,Lee Arenberg,Mackenzie Crook,Damian O'Hare,Giles New,Angus Barnett,David Bailie,Michael Berry Jr.,Isaac C. Singleton Jr.,Kevin McNally,Treva Etienne,Zoe Saldana,Guy Siner",PG-13,,
Dances with Wolves,,8.0,Adventure,1990,,"<p data-testid=""plot"" class=""sc-5f699a2-3 lopbTB""><span role=""presentation"" data-testid=""plot-xs_to_m"" class=""sc-5f699a2-0 kcphyk"">Lieutenant John Dunbar, assigned to a remote western Civil War outpost, finds himself engaging with a neighbouring Sioux settlement, causing him to question his own purpose.</span><span role=""presentation"" data-testid=""plot-l"" class=""sc-5f699a2-1 cfkOAP"">Lieutenant John Dunbar, assigned to a remote western Civil War outpost, finds himself engaging with a neighbouring Sioux settlement, causing him to question his own purpose.</span><span role=""presentation"" data-testid=""plot-xl"" class=""sc-5f699a2-2 cxqNYC"">Lieutenant John Dunbar, assigned to a remote western Civil War outpost, finds himself engaging with a neighbouring Sioux settlement, causing him to question his own purpose.</span></p>","Kevin Costner,Mary McDonnell,Graham Greene,Rodney A. Grant,Floyd 'Red Crow' Westerman,Tantoo Cardinal,Robert Pastorelli,Charles Rocket,Maury Chaykin,Jimmy Herman,Nathan Lee Chasing His Horse,Michael Spears,Jason R. Lone Hill,Tony Pierce,Doris Leader Charge,Tom Everett,Larry Joshua,Kirk Baltz",PG-13,"<a class=""ipc-metadata-list-item__list-content-item ipc-metadata-list-item__list-content-item--link"" role=""button"" tabindex=""0"" aria-disabled=""false"" href=""/search/title/?colors=color&amp;ref_=tt_spec_att"">Color</a>",
Dersu Uzala,,8.2,Adventure,1975,,"<p data-testid=""plot"" class=""sc-5f699a2-3 lopbTB""><span role=""presentation"" data-testid=""plot-xs_to_m"" class=""sc-5f699a2-0 kcphyk"">The Russian army sends an explorer on an expedition to the snowy Siberian wilderness where he makes friends with a seasoned local hunter.</span><span role=""presentation"" data-testid=""plot-l"" class=""sc-5f699a2-1 cfkOAP"">The Russian army sends an explorer on an expedition to the snowy Siberian wilderness where he makes friends with a seasoned local hunter.</span><span role=""presentation"" data-testid=""plot-xl"" class=""sc-5f699a2-2 cxqNYC"">The Russian army sends an explorer on an expedition to the snowy Siberian wilderness where he makes friends with a seasoned local hunter.</span></p>","Maksim Munzuk,Yuriy Solomin,Mikhail Bychkov,Vladimir Khrulyov,V. Lastochkin,Stanislav Marin,Igor Sykhra,Vladimir Sergiyakov,Yanis Yakobsons,Vladimir Khlestov,G. Polunin,V. Koldin,M. Tetov,S. Sinyavskiy,Vladimir Sverba,V. Ignatov,Vladimir Kremena,Aleksandr Pyatkov",G,"<a class=""ipc-metadata-list-item__list-content-item ipc-metadata-list-item__list-content-item--link"" role=""button"" tabindex=""0"" aria-disabled=""false"" href=""/search/title/?colors=color&amp;ref_=tt_spec_att"">Color</a>",
Aladdin,,8.0,Animation,1992,,"<p data-testid=""plot"" class=""sc-5f699a2-3 lopbTB""><span role=""presentation"" data-testid=""plot-xs_to_m"" class=""sc-5f699a2-0 kcphyk"">A kindhearted street urchin and a power-hungry Grand Vizier vie for a magic lamp that has the power to make their deepest wishes come true.</span><span role=""presentation"" data-testid=""plot-l"" class=""sc-5f699a2-1 cfkOAP"">A kindhearted street urchin and a power-hungry Grand Vizier vie for a magic lamp that has the power to make their deepest wishes come true.</span><span role=""presentation"" data-testid=""plot-xl"" class=""sc-5f699a2-2 cxqNYC"">A kindhearted street urchin and a power-hungry Grand Vizier vie for a magic lamp that has the power to make their deepest wishes come true.</span></p>","Scott Weinger,Robin Williams,Linda Larkin,Jonathan Freeman,Frank Welker,Gilbert Gottfried,Douglas Seale,Charlie Adler,Jack Angel,Corey Burton,Philip L. Clarke,Jim Cummings,Jennifer Darling,Debi Derryberry,Bruce Gooch,Jerry Houser,Vera Lockwood,Sherry Lynn",G,,
The Help,,8.1,Drama,2011,,"<p data-testid=""plot"" class=""sc-5f699a2-3 lopbTB""><span role=""presentation"" data-testid=""plot-xs_to_m"" class=""sc-5f699a2-0 kcphyk"">An aspiring author during the civil rights movement of the 1960s decides to write a book detailing the African American maids' point of view on the white families for which they work, and th...<!-- --> <a class=""ipc-link ipc-link--baseAlt"" role=""button"" tabindex=""0"" aria-disabled=""false"" data-testid=""plot-read-all-link"" href=""plotsummary?ref_=tt_ov_pl"">Read all</a></span><span role=""presentation"" data-testid=""plot-l"" class=""sc-5f699a2-1 cfkOAP"">An aspiring author during the civil rights movement of the 1960s decides to write a book detailing the African American maids' point of view on the white families for which they work, and the hardships they go through on a daily basis.</span><span role=""presentation"" data-testid=""plot-xl"" class=""sc-5f699a2-2 cxqNYC"">An aspiring author during the civil rights movement of the 1960s decides to write a book detailing the African American maids' point of view on the white families for which they work, and the hardships they go through on a daily basis.</span></p>","Viola Davis,Emma Stone,Octavia Spencer,Bryce Dallas Howard,Jessica Chastain,Ahna O'Reilly,Allison Janney,Anna Camp,Eleanor Henry,Emma Henry,Christopher Lowell,Cicely Tyson,Mike Vogel,Sissy Spacek,Brian Kerwin,Wes Chatham,Aunjanue Ellis-Taylor,Ted Welch",PG-13,"<a class=""ipc-metadata-list-item__list-content-item ipc-metadata-list-item__list-content-item--link"" role=""button"" tabindex=""0"" aria-disabled=""false"" href=""/search/title/?colors=color&amp;ref_=tt_spec_att"">Color</a>",
The Iron Giant,,8.1,Animation,1999,,"<p data-testid=""plot"" class=""sc-5f699a2-3 lopbTB""><span role=""presentation"" data-testid=""plot-xs_to_m"" class=""sc-5f699a2-0 kcphyk"">A young boy befriends a giant robot from outer space that a paranoid government agent wants to destroy.</span><span role=""presentation"" data-testid=""plot-l"" class=""sc-5f699a2-1 cfkOAP"">A young boy befriends a giant robot from outer space that a paranoid government agent wants to destroy.</span><span role=""presentation"" data-testid=""plot-xl"" class=""sc-5f699a2-2 cxqNYC"">A young boy befriends a giant robot from outer space that a paranoid government agent wants to destroy.</span></p>","Eli Marienthal,Harry Connick Jr.,Jennifer Aniston,Vin Diesel,James Gammon,Cloris Leachman,Christopher McDonald,John Mahoney,M. Emmet Walsh,Jack Angel,Bob Bergen,Mary Kay Bergman,Michael Bird,Devon Cole Borisoff,Rodger Bumpass,Robert Clotworthy,Jennifer Darling,Zack Eginton",PG,"<a class=""ipc-metadata-list-item__list-content-item ipc-metadata-list-item__list-content-item--link"" role=""button"" tabindex=""0"" aria-disabled=""false"" href=""/search/title/?sound_mixes=dolby_digital&amp;ref_=tt_spec_att"">Dolby Digital</a>",
Life of Brian,,8.0,Comedy,1979,,"<p data-testid=""plot"" class=""sc-5f699a2-3 lopbTB""><span role=""presentation"" data-testid=""plot-xs_to_m"" class=""sc-5f699a2-0 kcphyk"">Born on the original Christmas in the stable next door to Jesus Christ, Brian of Nazareth spends his life being mistaken for a messiah.</span><span role=""presentation"" data-testid=""plot-l"" class=""sc-5f699a2-1 cfkOAP"">Born on the original Christmas in the stable next door to Jesus Christ, Brian of Nazareth spends his life being mistaken for a messiah.</span><span role=""presentation"" data-testid=""plot-xl"" class=""sc-5f699a2-2 cxqNYC"">Born on the original Christmas in the stable next door to Jesus Christ, Brian of Nazareth spends his life being mistaken for a messiah.</span></p>","Graham Chapman,John Cleese,Michael Palin,Terry Gilliam,Eric Idle,Terry Jones,Terence Bayler,Carol Cleveland,Kenneth Colley,Neil Innes,Charles McKeown,John Young,Gwen Taylor,Sue Jones-Davies,Peter Brett,John Case,Chris Langham,Andrew MacLachlan",R,"<a class=""ipc-metadata-list-item__list-content-item ipc-metadata-list-item__list-content-item--link"" role=""button"" tabindex=""0"" aria-disabled=""false"" href=""/search/title/?colors=color&amp;ref_=tt_spec_att"">Color</a>",
Persona,,8.1,Drama,1966,,"<p data-testid=""plot"" class=""sc-5f699a2-3 lopbTB""><span role=""presentation"" data-testid=""plot-xs_to_m"" class=""sc-5f699a2-0 kcphyk"">A nurse is put in charge of a mute actress and finds that their personae are melding together.</span><span role=""presentation"" data-testid=""plot-l"" class=""sc-5f699a2-1 cfkOAP"">A nurse is put in charge of a mute actress and finds that their personae are melding together.</span><span role=""presentation"" data-testid=""plot-xl"" class=""sc-5f699a2-2 cxqNYC"">A nurse is put in charge of a mute actress and finds that their personae are melding together.</span></p>","Bibi Andersson,Liv Ullmann,Margaretha Krook,Gunnar Björnstrand,Jörgen Lindström",Not Rated,,
It Happened One Night,,8.1,Comedy,1934,,"<p data-testid=""plot"" class=""sc-5f699a2-3 lopbTB""><span role=""presentation"" data-testid=""plot-xs_to_m"" class=""sc-5f699a2-0 kcphyk"">A renegade reporter trailing a young runaway heiress for a big story joins her on a bus heading from Florida to New York, and they end up stuck with each other when the bus leaves them behin...<!-- --> <a class=""ipc-link ipc-link--baseAlt"" role=""button"" tabindex=""0"" aria-disabled=""false"" data-testid=""plot-read-all-link"" href=""plotsummary?ref_=tt_ov_pl"">Read all</a></span><span role=""presentation"" data-testid=""plot-l"" class=""sc-5f699a2-1 cfkOAP"">A renegade reporter trailing a young runaway heiress for a big story joins her on a bus heading from Florida to New York, and they end up stuck with each other when the bus leaves them behind at one of the stops.</span><span role=""presentation"" data-testid=""plot-xl"" class=""sc-5f699a2-2 cxqNYC"">A renegade reporter trailing a young runaway heiress for a big story joins her on a bus heading from Florida to New York, and they end up stuck with each other when the bus leaves them behind at one of the stops.</span></p>","Clark Gable,Claudette Colbert,Walter Connolly,Roscoe Karns,Jameson Thomas,Alan Hale,Arthur Hoyt,Blanche Friderici,Charles C. Wilson,Ernie Adams,Jessie Arnold,Irving Bacon,William Bailey,William Begg,William A. Boardway,Ward Bond,Harry C. Bradley,George P. Breakston",Passed,"<a class=""ipc-metadata-list-item__list-content-item ipc-metadata-list-item__list-content-item--link"" role=""button"" tabindex=""0"" aria-disabled=""false"" href=""/search/title/?colors=black_and_white&amp;ref_=tt_spec_att"">Black and White</a>",
The 400 Blows,Original title: Les quatre cents coups,8.1,Crime,1959,,"<p data-testid=""plot"" class=""sc-5f699a2-3 lopbTB""><span role=""presentation"" data-testid=""plot-xs_to_m"" class=""sc-5f699a2-0 kcphyk"">A young boy, left without attention, delves into a life of petty crime.</span><span role=""presentation"" data-testid=""plot-l"" class=""sc-5f699a2-1 cfkOAP"">A young boy, left without attention, delves into a life of petty crime.</span><span role=""presentation"" data-testid=""plot-xl"" class=""sc-5f699a2-2 cxqNYC"">A young boy, left without attention, delves into a life of petty crime.</span></p>","Jean-Pierre Léaud,Albert Rémy,Claire Maurier,Guy Decomble,Georges Flamant,Patrick Auffay,Daniel Couturier,François Nocher,Richard Kanayan,Renaud Fontanarosa,Michel Girard,Serge Moati,Bernard Abbou,Jean-François Bergouignan,Michel Lesignor,Luc Andrieux,Robert Beauvais,Bouchon",Not Rated,"<a class=""ipc-metadata-list-item__list-content-item ipc-metadata-list-item__list-content-item--link"" role=""button"" tabindex=""0"" aria-disabled=""false"" href=""/search/title/?colors=black_and_white&amp;ref_=tt_spec_att"">Black and White</a>",
The Sound of Music,,8.1,Biography,1965,,"<p data-testid=""plot"" class=""sc-5f699a2-3 lopbTB""><span role=""presentation"" data-testid=""plot-xs_to_m"" class=""sc-5f699a2-0 kcphyk"">A young novice is sent by her convent in 1930s Austria to become a governess to the seven children of a widowed naval officer.</span><span role=""presentation"" data-testid=""plot-l"" class=""sc-5f699a2-1 cfkOAP"">A young novice is sent by her convent in 1930s Austria to become a governess to the seven children of a widowed naval officer.</span><span role=""presentation"" data-testid=""plot-xl"" class=""sc-5f699a2-2 cxqNYC"">A young novice is sent by her convent in 1930s Austria to become a governess to the seven children of a widowed naval officer.</span></p>","Julie Andrews,Christopher Plummer,Eleanor Parker,Richard Haydn,Peggy Wood,Charmian Carr,Heather Menzies-Urich,Nicholas Hammond,Duane Chase,Angela Cartwright,Debbie Turner,Kym Karath,Anna Lee,Portia Nelson,Ben Wright,Daniel Truhitte,Norma Varden,Gilchrist Stuart",G,"<a class=""ipc-metadata-list-item__list-content-item ipc-metadata-list-item__list-content-item--link"" role=""button"" tabindex=""0"" aria-disabled=""false"" href=""/search/title/?colors=color&amp;ref_=tt_spec_att"">Color</a>",
The Handmaiden,Original title: Ah-ga-ssi,8.1,Drama,2016,,"<p data-testid=""plot"" class=""sc-5f699a2-3 lopbTB""><span role=""presentation"" data-testid=""plot-xs_to_m"" class=""sc-5f699a2-0 kcphyk"">A woman is hired as a handmaiden to a Japanese heiress, but secretly she is involved in a plot to defraud her.</span><span role=""presentation"" data-testid=""plot-l"" class=""sc-5f699a2-1 cfkOAP"">A woman is hired as a handmaiden to a Japanese heiress, but secretly she is involved in a plot to defraud her.</span><span role=""presentation"" data-testid=""plot-xl"" class=""sc-5f699a2-2 cxqNYC"">A woman is hired as a handmaiden to a Japanese heiress, but secretly she is involved in a plot to defraud her.</span></p>","Kim Min-hee,Ha Jung-woo,Cho Jin-woong,Moon So-ri,Kim Tae-ri,Yong-nyeo Lee,Min-chae Yoo,Dong-hwi Lee,Kim Hae-sook,Kyu-jung Lee,Si-eun Kim,Si-yeon Ha,Rina Takagi,Geun-hee Won,Jong-Dae Kim,Han-sun Jang,Eun-yeong Kim,Ri-woo Kim",Not Rated,,
Cool Hand Luke,,8.1,Crime,1967,,"<p data-testid=""plot"" class=""sc-5f699a2-3 lopbTB""><span role=""presentation"" data-testid=""plot-xs_to_m"" class=""sc-5f699a2-0 kcphyk"">A laid back Southern man is sentenced to two years in a rural prison, but refuses to conform.</span><span role=""presentation"" data-testid=""plot-l"" class=""sc-5f699a2-1 cfkOAP"">A laid back Southern man is sentenced to two years in a rural prison, but refuses to conform.</span><span role=""presentation"" data-testid=""plot-xl"" class=""sc-5f699a2-2 cxqNYC"">A laid back Southern man is sentenced to two years in a rural prison, but refuses to conform.</span></p>","Paul Newman,George Kennedy,Strother Martin,J.D. Cannon,Lou Antonio,Robert Drivas,Jo Van Fleet,Clifton James,Morgan Woodward,Luke Askew,Marc Cavell,Richard Davalos,Robert Donner,Warren Finnerty,Dennis Hopper,John McLiam,Wayne Rogers,Harry Dean Stanton",GP,"<a class=""ipc-metadata-list-item__list-content-item ipc-metadata-list-item__list-content-item--link"" role=""button"" tabindex=""0"" aria-disabled=""false"" href=""/search/title/?sound_mixes=mono&amp;ref_=tt_spec_att"">Mono</a>",
Rebecca,,8.1,Drama,1940,,"<p data-testid=""plot"" class=""sc-5f699a2-3 lopbTB""><span role=""presentation"" data-testid=""plot-xs_to_m"" class=""sc-5f699a2-0 kcphyk"">A self-conscious woman juggles adjusting to her new role as an aristocrat's wife and avoiding being intimidated by his first wife's spectral presence.</span><span role=""presentation"" data-testid=""plot-l"" class=""sc-5f699a2-1 cfkOAP"">A self-conscious woman juggles adjusting to her new role as an aristocrat's wife and avoiding being intimidated by his first wife's spectral presence.</span><span role=""presentation"" data-testid=""plot-xl"" class=""sc-5f699a2-2 cxqNYC"">A self-conscious woman juggles adjusting to her new role as an aristocrat's wife and avoiding being intimidated by his first wife's spectral presence.</span></p>","Laurence Olivier,Joan Fontaine,George Sanders,Judith Anderson,Nigel Bruce,Reginald Denny,C. Aubrey Smith,Gladys Cooper,Florence Bates,Melville Cooper,Leo G. Carroll,Leonard Carey,Lumsden Hare,Edward Fielding,Philip Winter,Forrester Harvey,Bunny Beatty,Billy Bevan",Approved,"<a class=""ipc-metadata-list-item__list-content-item ipc-metadata-list-item__list-content-item--link"" role=""button"" tabindex=""0"" aria-disabled=""false"" href=""/search/title/?colors=black_and_white&amp;ref_=tt_spec_att"">Black and White</a>",
