title,original_title,score,genre,year,duration,description,actors,public,country,language
Casino,,8.2,Crime,1995,,"<p data-testid=""plot"" class=""sc-5f699a2-3 lopbTB""><span role=""presentation"" data-testid=""plot-xs_to_m"" class=""sc-5f699a2-0 kcphyk"">A tale of greed, deception, money, power, and murder occur between two best friends: a mafia enforcer and a casino executive compete against each other over a gambling empire, and over a fas...<!-- --> <a class=""ipc-link ipc-link--baseAlt"" role=""button"" tabindex=""0"" aria-disabled=""false"" data-testid=""plot-read-all-link"" href=""plotsummary?ref_=tt_ov_pl"">Read all</a></span><span role=""presentation"" data-testid=""plot-l"" class=""sc-5f699a2-1 cfkOAP"">A tale of greed, deception, money, power, and murder occur between two best friends: a mafia enforcer and a casino executive compete against each other over a gambling empire, and over a fast-living and fast-loving socialite.</span><span role=""presentation"" data-testid=""plot-xl"" class=""sc-5f699a2-2 cxqNYC"">A tale of greed, deception, money, power, and murder occur between two best friends: a mafia enforcer and a casino executive compete against each other over a gambling empire, and over a fast-living and fast-loving socialite.</span></p>","Robert De Niro,Sharon Stone,Joe Pesci,James Woods,Don Rickles,Alan King,Kevin Pollak,L.Q. Jones,Dick Smothers,Frank Vincent,John Bloom,Pasquale Cajano,Melissa Prophet,Bill Allison,Vinny Vella,Philip Suriano,Erika von Tagen,Frankie Avalon",R,"<a class=""ipc-metadata-list-item__list-content-item ipc-metadata-list-item__list-content-item--link"" role=""button"" tabindex=""0"" aria-disabled=""false"" href=""/search/title/?colors=color&amp;ref_=tt_spec_att"">Color</a>",
Ran,,8.2,Action,1985,,"<p data-testid=""plot"" class=""sc-5f699a2-3 lopbTB""><span role=""presentation"" data-testid=""plot-xs_to_m"" class=""sc-5f699a2-0 kcphyk"">In Medieval Japan, an elderly warlord retires, handing over his empire to his three sons. However, he vastly underestimates how the new-found power will corrupt them and cause them to turn o...<!-- --> <a class=""ipc-link ipc-link--baseAlt"" role=""button"" tabindex=""0"" aria-disabled=""false"" data-testid=""plot-read-all-link"" href=""plotsummary?ref_=tt_ov_pl"">Read all</a></span><span role=""presentation"" data-testid=""plot-l"" class=""sc-5f699a2-1 cfkOAP"">In Medieval Japan, an elderly warlord retires, handing over his empire to his three sons. However, he vastly underestimates how the new-found power will corrupt them and cause them to turn on each other...and him.</span><span role=""presentation"" data-testid=""plot-xl"" class=""sc-5f699a2-2 cxqNYC"">In Medieval Japan, an elderly warlord retires, handing over his empire to his three sons. However, he vastly underestimates how the new-found power will corrupt them and cause them to turn on each other...and him.</span></p>","Tatsuya Nakadai,Akira Terao,Jinpachi Nezu,Daisuke Ryû,Mieko Harada,Yoshiko Miyazaki,Hisashi Igawa,Pîtâ,Masayuki Yui,Kazuo Katô,Norio Matsui,Toshiya Ito,Kenji Kodama,Takashi Watanabe,Mansai Nomura,Takeshi Katô,Jun Tazaki,Hitoshi Ueki",R,"<a class=""ipc-metadata-list-item__list-content-item ipc-metadata-list-item__list-content-item--link"" role=""button"" tabindex=""0"" aria-disabled=""false"" href=""/search/title/?colors=color&amp;ref_=tt_spec_att"">Color</a>",
Judgment at Nuremberg,,8.3,Drama,1961,,"<p data-testid=""plot"" class=""sc-5f699a2-3 lopbTB""><span role=""presentation"" data-testid=""plot-xs_to_m"" class=""sc-5f699a2-0 kcphyk"">In 1948, an American court in occupied Germany tries four Nazis judged for war crimes.</span><span role=""presentation"" data-testid=""plot-l"" class=""sc-5f699a2-1 cfkOAP"">In 1948, an American court in occupied Germany tries four Nazis judged for war crimes.</span><span role=""presentation"" data-testid=""plot-xl"" class=""sc-5f699a2-2 cxqNYC"">In 1948, an American court in occupied Germany tries four Nazis judged for war crimes.</span></p>","Spencer Tracy,Burt Lancaster,Richard Widmark,Marlene Dietrich,Maximilian Schell,Judy Garland,Montgomery Clift,William Shatner,Werner Klemperer,Kenneth MacKenna,Torben Meyer,Joseph Bernard,Alan Baxter,Edward Binns,Virginia Christine,Otto Waldis,Karl Swenson,Martin Brandt",Approved,"<a class=""ipc-metadata-list-item__list-content-item ipc-metadata-list-item__list-content-item--link"" role=""button"" tabindex=""0"" aria-disabled=""false"" href=""/search/title/?colors=black_and_white&amp;ref_=tt_spec_att"">Black and White</a>",
Green Book,,8.2,Biography,2018,,"<p data-testid=""plot"" class=""sc-5f699a2-3 lopbTB""><span role=""presentation"" data-testid=""plot-xs_to_m"" class=""sc-5f699a2-0 kcphyk"">A working-class Italian-American bouncer becomes the driver for an African-American classical pianist on a tour of venues through the 1960s American South.</span><span role=""presentation"" data-testid=""plot-l"" class=""sc-5f699a2-1 cfkOAP"">A working-class Italian-American bouncer becomes the driver for an African-American classical pianist on a tour of venues through the 1960s American South.</span><span role=""presentation"" data-testid=""plot-xl"" class=""sc-5f699a2-2 cxqNYC"">A working-class Italian-American bouncer becomes the driver for an African-American classical pianist on a tour of venues through the 1960s American South.</span></p>","Viggo Mortensen,Mahershala Ali,Linda Cardellini,Sebastian Maniscalco,Dimiter D. Marinov,Mike Hatton,P.J. Byrne,Joe Cortese,Maggie Nixon,Von Lewis,Jon Sortland,Don Stark,Anthony Mangano,Paul Sloan,Quinn Duffy,Seth Hurwitz,Hudson Galloway,Gavin Lyle Foley",PG-13,"<a class=""ipc-metadata-list-item__list-content-item ipc-metadata-list-item__list-content-item--link"" role=""button"" tabindex=""0"" aria-disabled=""false"" href=""/search/title/?country_of_origin=US&amp;ref_=tt_dt_cn"">United States</a>","<a class=""ipc-metadata-list-item__list-content-item ipc-metadata-list-item__list-content-item--link"" role=""button"" tabindex=""0"" aria-disabled=""false"" href=""/search/title?title_type=feature&amp;primary_language=en&amp;sort=moviemeter,asc&amp;ref_=tt_dt_ln"">English</a>"
The Wolf of Wall Street,,8.2,Biography,2013,,"<p data-testid=""plot"" class=""sc-5f699a2-3 lopbTB""><span role=""presentation"" data-testid=""plot-xs_to_m"" class=""sc-5f699a2-0 kcphyk"">Based on the true story of Jordan Belfort, from his rise to a wealthy stock-broker living the high life to his fall involving crime, corruption and the federal government.</span><span role=""presentation"" data-testid=""plot-l"" class=""sc-5f699a2-1 cfkOAP"">Based on the true story of Jordan Belfort, from his rise to a wealthy stock-broker living the high life to his fall involving crime, corruption and the federal government.</span><span role=""presentation"" data-testid=""plot-xl"" class=""sc-5f699a2-2 cxqNYC"">Based on the true story of Jordan Belfort, from his rise to a wealthy stock-broker living the high life to his fall involving crime, corruption and the federal government.</span></p>","Leonardo DiCaprio,Jonah Hill,Margot Robbie,Matthew McConaughey,Kyle Chandler,Rob Reiner,Jon Bernthal,Jon Favreau,Jean Dujardin,Joanna Lumley,Cristin Milioti,Christine Ebersole,Shea Whigham,Katarina Cas,P.J. Byrne,Kenneth Choi,Brian Sacca,Henry Zebrowski",R,,
All About Eve,,8.2,Drama,1950,,"<p data-testid=""plot"" class=""sc-5f699a2-3 lopbTB""><span role=""presentation"" data-testid=""plot-xs_to_m"" class=""sc-5f699a2-0 kcphyk"">A seemingly timid but secretly ruthless ingénue insinuates herself into the lives of an aging Broadway star and her circle of theater friends.</span><span role=""presentation"" data-testid=""plot-l"" class=""sc-5f699a2-1 cfkOAP"">A seemingly timid but secretly ruthless ingénue insinuates herself into the lives of an aging Broadway star and her circle of theater friends.</span><span role=""presentation"" data-testid=""plot-xl"" class=""sc-5f699a2-2 cxqNYC"">A seemingly timid but secretly ruthless ingénue insinuates herself into the lives of an aging Broadway star and her circle of theater friends.</span></p>","Bette Davis,Anne Baxter,George Sanders,Celeste Holm,Gary Merrill,Hugh Marlowe,Gregory Ratoff,Barbara Bates,Marilyn Monroe,Thelma Ritter,Walter Hampden,Randy Stuart,Craig Hill,Leland Harris,Barbara White,Eddie Fisher,William Pullen,Claude Stroud",Passed,"<a class=""ipc-metadata-list-item__list-content-item ipc-metadata-list-item__list-content-item--link"" role=""button"" tabindex=""0"" aria-disabled=""false"" href=""/search/title/?colors=black_and_white&amp;ref_=tt_spec_att"">Black and White</a>",
The Father,,8.2,Drama,2020,,"<p data-testid=""plot"" class=""sc-5f699a2-3 lopbTB""><span role=""presentation"" data-testid=""plot-xs_to_m"" class=""sc-5f699a2-0 kcphyk"">A man refuses all assistance from his daughter as he ages. As he tries to make sense of his changing circumstances, he begins to doubt his loved ones, his own mind and even the fabric of his...<!-- --> <a class=""ipc-link ipc-link--baseAlt"" role=""button"" tabindex=""0"" aria-disabled=""false"" data-testid=""plot-read-all-link"" href=""plotsummary?ref_=tt_ov_pl"">Read all</a></span><span role=""presentation"" data-testid=""plot-l"" class=""sc-5f699a2-1 cfkOAP"">A man refuses all assistance from his daughter as he ages. As he tries to make sense of his changing circumstances, he begins to doubt his loved ones, his own mind and even the fabric of his reality.</span><span role=""presentation"" data-testid=""plot-xl"" class=""sc-5f699a2-2 cxqNYC"">A man refuses all assistance from his daughter as he ages. As he tries to make sense of his changing circumstances, he begins to doubt his loved ones, his own mind and even the fabric of his reality.</span></p>","Anthony Hopkins,Olivia Colman,Mark Gatiss,Olivia Williams,Imogen Poots,Rufus Sewell,Ayesha Dharker,Roman Zeller,Adnan Kundi,Brian Rodger,Evie Wray",PG-13,"<a class=""ipc-metadata-list-item__list-content-item ipc-metadata-list-item__list-content-item--link"" role=""button"" tabindex=""0"" aria-disabled=""false"" href=""/search/title/?colors=color&amp;ref_=tt_spec_att"">Color</a>",
Some Like It Hot,,8.2,Comedy,1959,,"<p data-testid=""plot"" class=""sc-5f699a2-3 lopbTB""><span role=""presentation"" data-testid=""plot-xs_to_m"" class=""sc-5f699a2-0 kcphyk"">After two male musicians witness a mob hit, they flee the state in an all-female band disguised as women, but further complications set in.</span><span role=""presentation"" data-testid=""plot-l"" class=""sc-5f699a2-1 cfkOAP"">After two male musicians witness a mob hit, they flee the state in an all-female band disguised as women, but further complications set in.</span><span role=""presentation"" data-testid=""plot-xl"" class=""sc-5f699a2-2 cxqNYC"">After two male musicians witness a mob hit, they flee the state in an all-female band disguised as women, but further complications set in.</span></p>","Marilyn Monroe,Tony Curtis,Jack Lemmon,George Raft,Pat O'Brien,Joe E. Brown,Nehemiah Persoff,Joan Shawlee,Billy Gray,George E. Stone,Dave Barry,Mike Mazurki,Harry Wilson,Beverly Wills,Barbara Drew,Edward G. Robinson Jr.,Sam Bagley,Brandon Beach",Passed,"<a class=""ipc-metadata-list-item__list-content-item ipc-metadata-list-item__list-content-item--link"" role=""button"" tabindex=""0"" aria-disabled=""false"" href=""/search/title/?colors=black_and_white&amp;ref_=tt_spec_att"">Black and White</a>",
The Kid,,8.3,Comedy,1921,,"<p data-testid=""plot"" class=""sc-5f699a2-3 lopbTB""><span role=""presentation"" data-testid=""plot-xs_to_m"" class=""sc-5f699a2-0 kcphyk"">The Tramp cares for an abandoned child, but events put their relationship in jeopardy.</span><span role=""presentation"" data-testid=""plot-l"" class=""sc-5f699a2-1 cfkOAP"">The Tramp cares for an abandoned child, but events put their relationship in jeopardy.</span><span role=""presentation"" data-testid=""plot-xl"" class=""sc-5f699a2-2 cxqNYC"">The Tramp cares for an abandoned child, but events put their relationship in jeopardy.</span></p>","Charles Chaplin,Edna Purviance,Jackie Coogan,Carl Miller,Albert Austin,Beulah Bains,Nellie Bly Baker,Henry Bergman,Edward Biby,B.F. Blinn,Kitty Bradbury,Frank Campeau,Bliss Chevalier,Frances Cochran,Elsie Codd,Jack Coogan Sr.,Estelle Cook,Lillian Crane",Passed,,
Batman Begins,,8.2,Action,2005,,"<p data-testid=""plot"" class=""sc-5f699a2-3 lopbTB""><span role=""presentation"" data-testid=""plot-xs_to_m"" class=""sc-5f699a2-0 kcphyk"">After training with his mentor, Batman begins his fight to free crime-ridden Gotham City from corruption.</span><span role=""presentation"" data-testid=""plot-l"" class=""sc-5f699a2-1 cfkOAP"">After training with his mentor, Batman begins his fight to free crime-ridden Gotham City from corruption.</span><span role=""presentation"" data-testid=""plot-xl"" class=""sc-5f699a2-2 cxqNYC"">After training with his mentor, Batman begins his fight to free crime-ridden Gotham City from corruption.</span></p>","Christian Bale,Michael Caine,Ken Watanabe,Liam Neeson,Katie Holmes,Gary Oldman,Cillian Murphy,Tom Wilkinson,Rutger Hauer,Mark Boone Junior,Linus Roache,Morgan Freeman,Larry Holden,Gerard Murphy,Colin McFarlane,Sara Stewart,Gus Lewis,Richard Brake",PG-13,"<a class=""ipc-metadata-list-item__list-content-item ipc-metadata-list-item__list-content-item--link"" role=""button"" tabindex=""0"" aria-disabled=""false"" href=""/search/title/?colors=color&amp;ref_=tt_spec_att"">Color</a>",
For a Few Dollars More,Original title: Per qualche dollaro in più,8.2,Western,1965,,"<p data-testid=""plot"" class=""sc-5f699a2-3 lopbTB""><span role=""presentation"" data-testid=""plot-xs_to_m"" class=""sc-5f699a2-0 kcphyk"">Two bounty hunters with the same intentions team up to track down an escaped Mexican outlaw.</span><span role=""presentation"" data-testid=""plot-l"" class=""sc-5f699a2-1 cfkOAP"">Two bounty hunters with the same intentions team up to track down an escaped Mexican outlaw.</span><span role=""presentation"" data-testid=""plot-xl"" class=""sc-5f699a2-2 cxqNYC"">Two bounty hunters with the same intentions team up to track down an escaped Mexican outlaw.</span></p>","Clint Eastwood,Lee Van Cleef,Gian Maria Volontè,Mara Krupp,Luigi Pistilli,Klaus Kinski,Luis Rodríguez,Benito Stefanelli,Panos Papadopulos,Aldo Sambrell,Roberto Camardiel,Joseph Egger,Tomás Blanco,Lorenzo Robledo,Dante Maggio,Sergio Mendizábal,Diana Rabito,Giovanni Tarallo",R,"<a class=""ipc-metadata-list-item__list-content-item ipc-metadata-list-item__list-content-item--link"" role=""button"" tabindex=""0"" aria-disabled=""false"" href=""/search/title/?colors=color&amp;ref_=tt_spec_att"">Color</a>",
Dangal,,8.3,Biography,2016,,"<p data-testid=""plot"" class=""sc-5f699a2-3 lopbTB""><span role=""presentation"" data-testid=""plot-xs_to_m"" class=""sc-5f699a2-0 kcphyk"">Former wrestler Mahavir Singh Phogat and his two wrestler daughters struggle towards glory at the Commonwealth Games in the face of societal oppression.</span><span role=""presentation"" data-testid=""plot-l"" class=""sc-5f699a2-1 cfkOAP"">Former wrestler Mahavir Singh Phogat and his two wrestler daughters struggle towards glory at the Commonwealth Games in the face of societal oppression.</span><span role=""presentation"" data-testid=""plot-xl"" class=""sc-5f699a2-2 cxqNYC"">Former wrestler Mahavir Singh Phogat and his two wrestler daughters struggle towards glory at the Commonwealth Games in the face of societal oppression.</span></p>","Aamir Khan,Sakshi Tanwar,Fatima Sana Shaikh,Sanya Malhotra,Aparshakti Khurana,Zaira Wasim,Suhani Bhatnagar,Ritvik Sahore,Girish Kulkarni,Ravi Aneja,Anurag Arora,Mahesh Balraj,Vivan Bhatena,Anmol Charan,Karamveer Choudhary,Ishika Gagneja,Badrul Islam,Jagbir",Not Rated,,
Downfall,Original title: Der Untergang,8.2,Biography,2004,,"<p data-testid=""plot"" class=""sc-5f699a2-3 lopbTB""><span role=""presentation"" data-testid=""plot-xs_to_m"" class=""sc-5f699a2-0 kcphyk"">Traudl Junge, the final secretary for Adolf Hitler, tells of the Nazi dictator's final days in his Berlin bunker at the end of WWII.</span><span role=""presentation"" data-testid=""plot-l"" class=""sc-5f699a2-1 cfkOAP"">Traudl Junge, the final secretary for Adolf Hitler, tells of the Nazi dictator's final days in his Berlin bunker at the end of WWII.</span><span role=""presentation"" data-testid=""plot-xl"" class=""sc-5f699a2-2 cxqNYC"">Traudl Junge, the final secretary for Adolf Hitler, tells of the Nazi dictator's final days in his Berlin bunker at the end of WWII.</span></p>","Bruno Ganz,Alexandra Maria Lara,Ulrich Matthes,Juliane Köhler,Corinna Harfouch,Heino Ferch,Christian Berkel,Matthias Habich,Thomas Kretschmann,Michael Mendl,André Hennicke,Ulrich Noethen,Birgit Minichmayr,Rolf Kanies,Justus von Dohnányi,Dieter Mann,Christian Redl,Götz Otto",R,,
Top Gun: Maverick,,8.3,Action,2022,,"<p data-testid=""plot"" class=""sc-5f699a2-3 lopbTB""><span role=""presentation"" data-testid=""plot-xs_to_m"" class=""sc-5f699a2-0 kcphyk"">After thirty years, Maverick is still pushing the envelope as a top naval aviator, but must confront ghosts of his past when he leads TOP GUN's elite graduates on a mission that demands the ...<!-- --> <a class=""ipc-link ipc-link--baseAlt"" role=""button"" tabindex=""0"" aria-disabled=""false"" data-testid=""plot-read-all-link"" href=""plotsummary?ref_=tt_ov_pl"">Read all</a></span><span role=""presentation"" data-testid=""plot-l"" class=""sc-5f699a2-1 cfkOAP"">After thirty years, Maverick is still pushing the envelope as a top naval aviator, but must confront ghosts of his past when he leads TOP GUN's elite graduates on a mission that demands the ultimate sacrifice from those chosen to fly it.</span><span role=""presentation"" data-testid=""plot-xl"" class=""sc-5f699a2-2 cxqNYC"">After thirty years, Maverick is still pushing the envelope as a top naval aviator, but must confront ghosts of his past when he leads TOP GUN's elite graduates on a mission that demands the ultimate sacrifice from those chosen to fly it.</span></p>","Tom Cruise,Jennifer Connelly,Miles Teller,Val Kilmer,Bashir Salahuddin,Jon Hamm,Charles Parnell,Monica Barbaro,Lewis Pullman,Jay Ellis,Danny Ramirez,Glen Powell,Jack Schumacher,Manny Jacinto,Kara Wang,Greg Tarzan Davis,Jake Picking,Raymond Lee",PG-13,,
1917,,8.2,Action,2019,,"<p data-testid=""plot"" class=""sc-5f699a2-3 lopbTB""><span role=""presentation"" data-testid=""plot-xs_to_m"" class=""sc-5f699a2-0 kcphyk"">April 6th, 1917. As an infantry battalion assembles to wage war deep in enemy territory, two soldiers are assigned to race against time and deliver a message that will stop 1,600 men from wa...<!-- --> <a class=""ipc-link ipc-link--baseAlt"" role=""button"" tabindex=""0"" aria-disabled=""false"" data-testid=""plot-read-all-link"" href=""plotsummary?ref_=tt_ov_pl"">Read all</a></span><span role=""presentation"" data-testid=""plot-l"" class=""sc-5f699a2-1 cfkOAP"">April 6th, 1917. As an infantry battalion assembles to wage war deep in enemy territory, two soldiers are assigned to race against time and deliver a message that will stop 1,600 men from walking straight into a deadly trap.</span><span role=""presentation"" data-testid=""plot-xl"" class=""sc-5f699a2-2 cxqNYC"">April 6th, 1917. As an infantry battalion assembles to wage war deep in enemy territory, two soldiers are assigned to race against time and deliver a message that will stop 1,600 men from walking straight into a deadly trap.</span></p>","Dean-Charles Chapman,George MacKay,Daniel Mays,Colin Firth,Pip Carter,Andy Apollo,Paul Tinto,Josef Davies,Billy Postlethwaite,Gabriel Akuwudike,Andrew Scott,Spike Leighton,Robert Maaser,Gerran Howell,Adam Hugill,Mark Strong,Richard McCabe,Benjamin Adams",R,"<a class=""ipc-metadata-list-item__list-content-item ipc-metadata-list-item__list-content-item--link"" role=""button"" tabindex=""0"" aria-disabled=""false"" href=""/search/title/?colors=color&amp;ref_=tt_spec_att"">Color</a>",
Like Stars on Earth,Original title: Taare Zameen Par,8.3,Drama,2007,,"<p data-testid=""plot"" class=""sc-5f699a2-3 lopbTB""><span role=""presentation"" data-testid=""plot-xs_to_m"" class=""sc-5f699a2-0 kcphyk"">An eight-year-old boy is thought to be a lazy trouble-maker, until the new art teacher has the patience and compassion to discover the real problem behind his struggles in school.</span><span role=""presentation"" data-testid=""plot-l"" class=""sc-5f699a2-1 cfkOAP"">An eight-year-old boy is thought to be a lazy trouble-maker, until the new art teacher has the patience and compassion to discover the real problem behind his struggles in school.</span><span role=""presentation"" data-testid=""plot-xl"" class=""sc-5f699a2-2 cxqNYC"">An eight-year-old boy is thought to be a lazy trouble-maker, until the new art teacher has the patience and compassion to discover the real problem behind his struggles in school.</span></p>","Darsheel Safary,Aamir Khan,Tanay Chheda,Sachet Engineer,Tisca Chopra,Vipin Sharma,Lalitha Lajmi,Girija Oak,Ravi Khanvilkar,Pratima Kulkarni,Meghna Malik,Sonali Sachdev,Sanjay Dadhich,Rajgopal Iyer,Bugs Bhargava Krishna,Shankar Sachdev,M.K. Raina,Gurkirtan",PG,"<a class=""ipc-metadata-list-item__list-content-item ipc-metadata-list-item__list-content-item--link"" role=""button"" tabindex=""0"" aria-disabled=""false"" href=""/search/title/?colors=color&amp;ref_=tt_spec_att"">Color</a>",
Bicycle Thieves,Original title: Ladri di biciclette,8.3,Drama,1948,,"<p data-testid=""plot"" class=""sc-5f699a2-3 lopbTB""><span role=""presentation"" data-testid=""plot-xs_to_m"" class=""sc-5f699a2-0 kcphyk"">In post-war Italy, a working-class man's bicycle is stolen, endangering his efforts to find work. He and his son set out to find it.</span><span role=""presentation"" data-testid=""plot-l"" class=""sc-5f699a2-1 cfkOAP"">In post-war Italy, a working-class man's bicycle is stolen, endangering his efforts to find work. He and his son set out to find it.</span><span role=""presentation"" data-testid=""plot-xl"" class=""sc-5f699a2-2 cxqNYC"">In post-war Italy, a working-class man's bicycle is stolen, endangering his efforts to find work. He and his son set out to find it.</span></p>","Lamberto Maggiorani,Enzo Staiola,Lianella Carell,Elena Altieri,Gino Saltamerenda,Giulio Chiari,Vittorio Antonucci,Michele Sakara,Fausto Guerzoni,Emma Druetti,Carlo Jachino,Giulio Battiferri,Ida Bracci Dorati,Nando Bruno,Eolo Capritti,Memmo Carotenuto,Giovanni Corporale,Veriano Ginesi",Not Rated,"<a class=""ipc-metadata-list-item__list-content-item ipc-metadata-list-item__list-content-item--link"" role=""button"" tabindex=""0"" aria-disabled=""false"" href=""/search/title/?colors=black_and_white&amp;ref_=tt_spec_att"">Black and White</a>",
Snatch,,8.2,Comedy,2000,,"<p data-testid=""plot"" class=""sc-5f699a2-3 lopbTB""><span role=""presentation"" data-testid=""plot-xs_to_m"" class=""sc-5f699a2-0 kcphyk"">Unscrupulous boxing promoters, violent bookmakers, a Russian gangster, incompetent amateur robbers and supposedly Jewish jewelers fight to track down a priceless stolen diamond.</span><span role=""presentation"" data-testid=""plot-l"" class=""sc-5f699a2-1 cfkOAP"">Unscrupulous boxing promoters, violent bookmakers, a Russian gangster, incompetent amateur robbers and supposedly Jewish jewelers fight to track down a priceless stolen diamond.</span><span role=""presentation"" data-testid=""plot-xl"" class=""sc-5f699a2-2 cxqNYC"">Unscrupulous boxing promoters, violent bookmakers, a Russian gangster, incompetent amateur robbers and supposedly Jewish jewelers fight to track down a priceless stolen diamond.</span></p>","Jason Statham,Brad Pitt,Stephen Graham,Vinnie Jones,Ade,William Beck,Andy Beckwith,Ewen Bremner,Jason Buckham,Mickey Cantwell,Nicola Collins,Teena Collins,Charles Cork,James Cunningham,Sorcha Cusack,Mickey Dee,Benicio Del Toro,Sam Douglas",R,"<a class=""ipc-metadata-list-item__list-content-item ipc-metadata-list-item__list-content-item--link"" role=""button"" tabindex=""0"" aria-disabled=""false"" href=""/search/title/?colors=color&amp;ref_=tt_spec_att"">Color</a>",
Indiana Jones and the Last Crusade,,8.2,Action,1989,,"<p data-testid=""plot"" class=""sc-5f699a2-3 lopbTB""><span role=""presentation"" data-testid=""plot-xs_to_m"" class=""sc-5f699a2-0 kcphyk"">In 1938, after his father goes missing while pursuing the Holy Grail, Indiana Jones finds himself up against the Nazis again to stop them from obtaining its powers.</span><span role=""presentation"" data-testid=""plot-l"" class=""sc-5f699a2-1 cfkOAP"">In 1938, after his father goes missing while pursuing the Holy Grail, Indiana Jones finds himself up against the Nazis again to stop them from obtaining its powers.</span><span role=""presentation"" data-testid=""plot-xl"" class=""sc-5f699a2-2 cxqNYC"">In 1938, after his father goes missing while pursuing the Holy Grail, Indiana Jones finds himself up against the Nazis again to stop them from obtaining its powers.</span></p>","Harrison Ford,Sean Connery,Alison Doody,Denholm Elliott,John Rhys-Davies,Julian Glover,River Phoenix,Michael Byrne,Kevork Malikyan,Robert Eddison,Richard Young,Alexei Sayle,Alex Hyde-White,Paul Maxwell,Isla Blair,Vernon Dobtcheff,J.J. Hardy,Bradley Gregg",PG-13,"<a class=""ipc-metadata-list-item__list-content-item ipc-metadata-list-item__list-content-item--link"" role=""button"" tabindex=""0"" aria-disabled=""false"" href=""/search/title/?colors=color&amp;ref_=tt_spec_att"">Color</a>",
